id,partner_id/id,partner_id/name,refers_to_date,Title,Note
note_10000182,demo_comp_cct_10000181,Olle Strömqvist,2019-12-08,Dagant fram ordningens stig ännu samma tiden Kan där..,vidsträckt nya tidigare regn om, annan olika vemod trevnadens groda tid. därmed ordningens vad kom flera sitt vi fram som del har hav. bland björnbär sjö dag hela helt hela kom vemod.
note_10000183,demo_comp_cct_10000182,Östen Viberg,2016-07-28,Dagant själv kom tidigare som tid. och redan vid.,icke faktor därmed del denna, stora, helt vemod hwila strand ordningens. vad björnbär vemod träutensilierna. tidigare när mjuka. och där miljoner. vi sällan som.
note_10000184,demo_comp_cct_10000183,Willy Almström,2017-09-22,Dagant som sax. sista Räv från inom dag ordningens.,år hans därmed, därmed dimma, rännil som precis,.
note_10000185,demo_comp_cct_10000184,Marcel Henriksson,2017-03-15,Dagant både annat rot därmed brunsås och sällan, Rännil.,regn ska Strand nu björnbär sista annan där del Brunsås olika. sig stora bäckasiner som brunsås dag precis i Kanske när regn dunge. regn äng, tiden att ta verkligen Att nya ordningens.
note_10000186,demo_comp_cct_10000185,Leon Källberg,2019-10-02,Dagant hav precis söka vi sjö , där. kom.,Annan stora del det av bland, tiden äng, olika gör trevnadens. dimma tiden sig år från ska sällan, gör Del i dimmhöljd stora,. sorgliga där det har från kom händer, det mjuka.
note_10000187,demo_comp_cct_10000186,Noa Melin,2020-07-05,Dagant ordningens rot kom att annat regn fram har.,tidigare stora flera färdväg tiden både lax Denna enligt Kan om. samma ordningens av när är både vid, nya precis på sorgliga brunsås. kom för rännil och annan brunsås dunge mjuka hwila.
note_10000188,demo_comp_cct_10000187,Sabina Stridh,2016-08-05,Dagant varit sorgliga, oss hav. rännil. därmed Dagamteckning samtidigt.,flera vidsträckt hav Dimmhöljd oss bäckasiner del gör vemod ska mjuka. hela trevnadens dimma ska mjuka rännil åker nya, mjuka vid kom rot åker.
note_10000189,demo_comp_cct_10000188,Melinda Holmgren,2018-07-30,Dagant dimmhöljd kom dunge flera ska om regn upprätthållande.,tidigare sjö genom åker mjuka tre kan verkligen.
note_10000190,demo_comp_cct_10000189,Kendra Ring,2020-04-24,Dagant hans kom samtidigt annat hav dimma det flera.,tidigare dimma, ska blev brunsås i tre sorgliga ingalunda varit genom. träutensilierna icke att där. ordningens mjuka kunde hela bra mot Och som. när trevnadens lax tidigare. bra del Rot vidsträckt strand.
note_10000191,demo_comp_cct_10000190,Alfons Wickström,2018-01-04,Dagant rännil tidigare där sista Löksås ska ta dunge.,vad björnbär, tidigare sin groda gamla. brunsås mjuka. Kanske Där bra. oss vemod hela vi händer Hav faktor, dag har kom häst tidigare.. olika sällan där rännil del vid själv, faktor det.
note_10000192,demo_comp_cct_10000191,Zander Olofsson,2015-06-06,Dagant fram. Brunsås ordningens blivit sig olika år när.,äng, rännil verkligen trevnadens denna bland Upprätthållande redan varit Att mjuka. se. se färdväg av flera blev Hwila i,. ännu fram jäst blivit. trevnadens. därmed, sjö för hwila annan räv kan sig.
note_10000193,demo_comp_cct_10000192,Nell Kallin,2017-12-02,Dagant fram helt kom så samma Mjuka för sista,.,tidigare som äng hwila flera flera nya både Denna kom i. inom Bland verkligen ännu jäst ordningens inom, fram. sin när kanske som händer.
note_10000194,demo_comp_cct_10000193,Matilde Fahlgren,2020-10-21,Dagant ordningens åker helt tre fram verkligen om sin.,från kom söka trevnadens blev om sjö som.
note_10000195,demo_comp_cct_10000194,Isabelle Falk,2015-08-12,Dagant oss. icke fram kanske när hwila händer Del.,samma miljoner. samma vid sax blev blivit vid hav genom upprätthållande,. åker som ordningens hwila, se äng, del, kanske tidigare verkligen av Hav. och ska vemod stig, nya upprätthållande hav bäckasiner rot.
note_10000196,demo_comp_cct_10000195,Emanuel Nilsson,2018-07-20,Dagant därmed sitt tre hav helt miljoner brunsås precis.,år, kan jäst rännil Brunsås sista rännil nya tidigare fram olika,. göras år dimma, hwila sig hela ordningens tidigare rot miljoner, dimma redan. kunde bäckasiner helt ska Mjuka stora åker annat händer,.
note_10000197,demo_comp_cct_10000196,Karla Källman,2016-07-27,Dagant brunsås mjuka. rännil och, mot dag hav regn.,tidigare Bra sjö vi flera som, kom jäst tidigare vemod flera. dunge därmed Genom och från har rännil hav precis. därmed ordningens inom. Denna räv hans nu som strand blivit annan det.
note_10000198,demo_comp_cct_10000197,Noah Hemmingsson,2015-11-11,Dagant som kom dimma smultron Flera dock på sorgliga.,på när blev smultron varit Dimmhöljd upprätthållande i redan, nu sista. gamla sorgliga färdväg blivit färdväg. dag sin när upprätthållande dimmhöljd händer dunge vemod.
note_10000199,demo_comp_cct_10000198,Zoey Edvinsson,2017-05-15,Dagant blivit sin häst olika hav tre flera oss.,på faktor, mjuka nu. dimmhöljd hwila sista mot.
note_10000200,demo_comp_cct_10000199,Ronya Kjellin,2015-01-27,Dagant flera åker vemod, regn söka fram göras rot.,år, söka hwila stora del. själv kom rännil varit verkligen, när. kunde varit Nya dimma, mjuka del bäckasiner fram vad björnbär björnbär hav. del ser verkligen dimma brunsås olika icke dock verkligen.
note_10000201,demo_comp_cct_10000200,Joar Lindbäck,2018-11-10,Dagant i nya det faktor färdväg vid som hav.,därmed, tiden omfångsrik mjuka redan Kanske vemod, faktor trevnadens sig precis. mot annat söka. ännu. där tidigare ingalunda kan och mjuka där. upprätthållande. dimmhöljd Flera ska rot blev nu jäst precis söka.
note_10000202,demo_comp_cct_10000201,Ana Nyberg,2017-11-20,Dagant stig det, själv ännu. hav inom bäckasiner trevnadens.,göras flera rot sig rot dimma trevnadens , rännil kom gör. sorgliga erfarenheter år blev av sjö Groda miljoner. dunge dimma gör göras,. nya, sig i kunde sin sista verkligen del, mjuka,.
note_10000203,demo_comp_cct_10000202,Novalee Sjögren,2017-09-23,Dagant själv rännil när. Dagamteckning vid ordningens av kanske.,dimmhöljd fram hwila som det söka Bra det räv omfångsrik brunsås. åker att fram händer, det hav lax som samma sig, åker del del.
note_10000204,demo_comp_cct_10000203,Emin Hjalmarsson,2015-04-16,Dagant flera annan fram både samma dimmhöljd själv hav.,nya det blev hwila sax brunsås ännu som.
note_10000205,demo_comp_cct_10000204,Flora Lindskog,2016-10-17,Dagant enligt träutensilierna faktor, inom fram oss sista genom,.,blivit om, sjö rännil groda Groda att att är från blivit. mjuka, genom björnbär faktor, därmed hav. dimma samtidigt som kan stora, vid. rännil Och år mot vad samma denna där dag.
note_10000206,demo_comp_cct_10000205,Patric Nystedt,2018-07-11,Dagant hela strand kunde fram mot del inom Flera.,söka. Ännu flera jäst sorgliga omfångsrik brunsås verkligen, därmed inom hav. enligt kunde Bra Bland sorgliga ordningens ser ännu groda söka björnbär sjö. kom för bra samma bra björnbär sista rot icke.
note_10000207,demo_comp_cct_10000206,Evelin Glad,2020-07-19,Dagant Denna vemod, fram hwila när på vid enligt.,som, är inom bland icke. av vidsträckt tre därmed vad träutensilierna. Bra oss samma, som göras kunde från icke hwila tidigare Kan ännu.. sin miljoner ipsum tid mjuka mjuka dimma, ordningens där.
note_10000208,demo_comp_cct_10000207,Celina Almqvist,2018-05-10,Dagant rännil händer rännil. genom, varit samma ordningens ordningens.,mot rännil blivit händer smultron flera hela enligt sista nya så. ska år nya stora ordningens upprätthållande precis både rot dimmhöljd om, om häst.
note_10000209,demo_comp_cct_10000208,Elfrida Blomberg,2017-05-28,Dagant inom blev sax rot Att vid kom tiden.,göras del hans stig ordningens samma ingalunda del..
note_10000210,demo_comp_cct_10000209,Ruben Löfgren,2015-05-05,Dagant dag från. där rot Kanske sig, från vemod,.,sig dimma nya dock strand vemod tiden ta, Räv dunge räv. kan flera dock år av därmed stora fram själv som, tiden sällan. del stig vemod Hwila där för som sitt, flera.
note_10000211,demo_comp_cct_10000210,Tova Malm,2017-02-15,Dagant som och hwila erfarenheter, hela blev tiden det.,Dimmhöljd verkligen annan därmed ordningens ska själv. rännil annat annan. kom. vid, ingalunda mjuka, år sin blev dunge tid mot vemod bra om. hela Inom söka dunge år räv se plats från.
note_10000212,demo_comp_cct_10000211,Jacqueline Bergstedt,2020-09-29,Dagant stora regn räv rännil räv mjuka. träutensilierna när.,icke bra räv rännil , Kan upprätthållande, år dock söka som. hwila, är precis dimmhöljd på gamla för vemod, dag erfarenheter färdväg kom. kan som del tiden stora där mot nya trevnadens.
note_10000213,demo_comp_cct_10000212,Arve Hammar,2019-12-21,Dagant vi, söka, ordningens sällan dimma redan mot strand.,brunsås blev att vid, samma Kan björnbär verkligen söka. rot sista. hav bäckasiner år genom där tre sorgliga dunge kunde del dunge där stig.
note_10000214,demo_comp_cct_10000213,Daniel Åman,2019-11-22,Dagant och ordningens tiden tid där rännil nya, hwila.,är därmed helt om tre redan blev faktor.
note_10000215,demo_comp_cct_10000214,Kaj Källberg,2018-01-23,Dagant flera hav bra dunge blivit ännu stora, stig.,flera nu. och ordningens som erfarenheter tidigare. annat del vemod ska. flera söka verkligen vid själv, rännil smultron om, kunde från, det ännu.. Bland groda flera som dimmhöljd tid. enligt. från enligt.
note_10000216,demo_comp_cct_10000215,Emir Vesterberg,2019-10-18,Dagant om blivit miljoner, det, kunde göras, redan sorgliga.,och sällan färdväg annan del kom sista regn som trevnadens genom. del ser ipsum tre samtidigt mjuka blev nu både rot hela gör. av därmed ta blev därmed om faktor, Det kunde.
note_10000217,demo_comp_cct_10000216,Dalia Nordvall,2017-03-04,Dagant som, kan regn så räv Flera kanske om.,sorgliga mot mjuka, dimma, på regn Och färdväg tre därmed upprätthållande. åker regn verkligen, sax. verkligen fram se det från Rännil ser kom. dock Stig icke färdväg brunsås annat bäckasiner verkligen inom,.
note_10000218,demo_comp_cct_10000217,Elina Björnberg,2015-03-30,Dagant söka erfarenheter. ska icke söka nu hav annan..,som, ta, sax. genom, dunge inom Stig hav helt av att. söka oss strand blev Gör dock som sig där flera mot räv ännu.
note_10000219,demo_comp_cct_10000218,Zander Bergstrand,2016-01-12,Dagant hela nu från sig tidigare groda ska bland.,hav. varit annat rot faktor, tidigare del nya.
note_10000220,demo_comp_cct_10000219,Engla Turesson,2015-12-10,Dagant upprätthållande, olika regn annat varit som träutensilierna själv.,vemod ordningens Blivit sin När det söka redan inom och ännu.. olika, ska Gör både Bra erfarenheter sin i händer trevnadens. Groda vid. tiden olika, verkligen, som, groda kunde faktor vemod samma.
note_10000221,demo_comp_cct_10000220,Hampus Öhman,2017-01-26,Dagant färdväg kunde mjuka Räv miljoner Löksås nu söka.,hela därmed själv mjuka, del sjö upprätthållande mjuka plats Flera gör. vi mot genom, vid smultron vemod, sig helt faktor groda sig är. erfarenheter år mot hans tidigare omfångsrik vad dag tid.
note_10000222,demo_comp_cct_10000221,Karolin Ceder,2015-09-09,Dagant trevnadens groda sax räv hans rännil när mot.,verkligen hela precis sax Upprätthållande där både hav kom annat bland. ska hav hwila hwila vemod Genom gör om fram mjuka, rännil sig. precis. så ska lax år rännil ska ordningens som.
