id,partner_id/id,partner_id/name,refers_to_date,Title,Note
note_10000001,demo_comp_cct_10000001,Org PILGRIMSTAD         ,2019-08-06,Dagant fram gör i händer mot stig samtidigt se.,del bra ser sax hans av ingalunda hwila, sorgliga vemod denna. som händer händer därmed samtidigt flera oss sorgliga varit mjuka på hav.. år fram. är omfångsrik har ordningens stora brunsås. att.
note_10000002,demo_comp_cct_10000002,Org HUDIKSVALL          ,2015-08-28,Dagant flera mot redan, dunge, Löksås ska söka tiden.,rännil. verkligen sin blev inom och kom samma häst Groda björnbär. trevnadens precis ännu flera samma genom denna. hwila upprätthållande gör det, kan brunsås..
note_10000003,demo_comp_cct_10000003,Org HAPARANDA           ,2016-11-10,Dagant Bra bäckasiner icke annan. är kanske dag ta.,vemod dag redan kan som hav när själv..
note_10000004,demo_comp_cct_10000004,Org ULRICEHAMN          ,2019-07-10,Dagant se ta av samtidigt, och sin blev sitt.,ingalunda på kanske brunsås genom, mot när är om annan sorgliga. denna tidigare ska tid, upprätthållande, sig när dag från, vemod när trevnadens. fram dimmhöljd flera oss samma annan tiden se. blev.
note_10000005,demo_comp_cct_10000005,Org VÅRGÅRDA            ,2018-04-17,Dagant tidigare Gör bland Löksås därmed Upprätthållande åker vi,.,sax. själv flera bra ordningens upprätthållande tiden år, flera kom äng. Gör Denna verkligen som när hav fram sista och rännil tidigare och. söka sig söka kan bra färdväg träutensilierna. där strand.
note_10000006,demo_comp_cct_10000006,Org VÅRBY               ,2019-06-24,Dagant Upprätthållande annat rännil tre bland från dimma, fram.,genom är denna nya sorgliga om dimma av nu. både hwila. av brunsås varit sitt, sjö, därmed brunsås. brunsås rot mjuka äng flera. äng, fram är samma räv annan rot sitt, hav.
note_10000007,demo_comp_cct_10000007,Org JÖNKÖPING           ,2017-06-06,Dagant upprätthållande sig ta, samma, det, och Kan faktor.,fram. ännu gör samtidigt faktor, dag olika verkligen dag samma räv. Blev träutensilierna rännil flera genom gör. göras bland färdväg dunge ta redan söka,.
note_10000008,demo_comp_cct_10000008,Org HAVDHEM             ,2016-06-19,Dagant flera fram ingalunda det som, göras, helt mjuka.,kom dag dunge denna redan, vemod, det på.
note_10000009,demo_comp_cct_10000009,Org NORRKÖPING          ,2019-12-08,Dagant och om ingalunda tidigare bra när helt oss.,brunsås verkligen Mjuka nya, mot häst räv dag som ska mjuka,. det ordningens mjuka färdväg gör både kom bland, ser äng, dimma, ordningens. del redan av upprätthållande dunge kan som tidigare jäst.
note_10000010,demo_comp_cct_10000010,Org PARTILLE            ,2015-06-22,Dagant regn nya så rot och vad plats strand.,varit regn upprätthållande icke strand göras annan därmed, olika, sax gör. som samtidigt, träutensilierna se på mot hans tidigare där. söka. dock, dag,. stig, kom samtidigt nu Stig på. Kan rot som.
note_10000011,demo_comp_cct_10000011,Org UPPSALA             ,2020-03-11,Dagant vad där vi, del äng, själv inom erfarenheter.,och ska Genom Upprätthållande smultron annan. dunge själv. dock där för. erfarenheter, bäckasiner kom själv miljoner oss verkligen gamla miljoner sorgliga, dimma Annat. Flera tidigare kanske när. rot nya strand Och regn.
note_10000012,demo_comp_cct_10000012,Org KÄVLINGE            ,2020-10-24,Dagant upprätthållande nya från själv. tid verkligen sig, sorgliga,.,annat varit enligt bra mot vi som jäst nya vad gör. samtidigt ta, dag samma tid från brunsås. sig hwila, vid, gör räv dimma.
note_10000013,demo_comp_cct_10000013,Org EMMABODA            ,2020-01-20,Dagant annat stora för bäckasiner rot göras så faktor.,sjö bäckasiner upprätthållande, björnbär gamla del rot blev.
note_10000014,demo_comp_cct_10000014,Org JÄRLÅSA             ,2018-09-03,Dagant Bäckasiner miljoner och bäckasiner erfarenheter. göras fram när..,ipsum Att är när kunde för del vemod, när söka, vemod. tiden verkligen vid där rännil stora tre och, sig mjuka bäckasiner att. så nu. sig stig som, det på dunge, mot.
note_10000015,demo_comp_cct_10000015,Org NACKA               ,2019-01-03,Dagant hwila därmed groda enligt sista, tiden hans hav.,är samtidigt sax träutensilierna som, kan och mot så kom fram. gör räv sjö när inom av bäckasiner Dimmhöljd tre både gamla. hans,. är dunge som rot nu. Sorgliga som, vad nya.
note_10000016,demo_comp_cct_10000016,Org GÖTEBORG            ,2017-07-25,Dagant hav. tidigare. bäckasiner samtidigt Hwila Blivit groda regn.,hav oss del upprätthållande sig, Varit mjuka. björnbär söka, stig rot. annan göras brunsås hav färdväg ska brunsås därmed Annat räv inom det. dock kom vid, åker helt dimmhöljd vid åker om.
note_10000017,demo_comp_cct_10000017,Org HÄSSELBY            ,2019-12-05,Dagant både del där. därmed och kan upprätthållande mjuka.,sorgliga sitt mjuka och att det inom därmed, ta oss. brunsås. hans dag ska vemod när hwila om har redan, hwila fram blev. faktor, omfångsrik stora kom Sorgliga precis, upprätthållande lax Icke.
note_10000018,demo_comp_cct_10000018,Org HELSINGBORG         ,2016-02-06,Dagant av Brunsås varit stig sjö, som där som.,sista, av annan. verkligen stig när flera Denna redan äng söka. sitt, händer, nu. del genom blev upprätthållande tiden Dagamteckning hans rännil ännu inom,.
note_10000019,demo_comp_cct_10000019,Izabelle Viktorsson,2020-12-04,Dagant kunde som helt det stora enligt både regn.,hans vid, sista trevnadens del faktor kom ordningens.
note_10000020,demo_comp_cct_10000020,Emely Svensson (comp 10019),2018-06-26,Dagant själv strand Mjuka samtidigt upprätthållande som år när.,icke Icke stora vemod dag sällan, nu sig denna av hav. dimma När tidigare varit både där ska kom faktor sista dag annat. Flera på för hans har stora gör och bäckasiner.
note_10000021,demo_comp_cct_10000020,Bertil Sundell (comp 10020),2019-04-03,Dagant inom stora Bra bäckasiner vemod av åker hav.,samtidigt strand mjuka fram för del omfångsrik sista dock färdväg tid. sista olika, dimma söka Sällan dimma som tiden från kom redan, Annat. så när icke från häst häst oss. mot som,.
note_10000022,demo_comp_cct_10000021,Lillie Forslund (comp 10021),2017-03-11,Dagant flera samtidigt vi blev vid inom åker tid.,mjuka precis, Bra ska Hans kom varit nu för i verkligen. lax göras ännu fram. genom tre samma för ordningens ännu. vemod kom. hela Varit björnbär det samma sin jäst Blivit räv.
note_10000023,demo_comp_cct_10000022,Hannah Svan (comp 10022),2020-03-16,Dagant vemod för och där dimma vi kan, genom,.,stora därmed stora själv, dimma av därmed där. mjuka hav. söka.. som som bra på vid, sig sjö verkligen tidigare. när söka. både mjuka.
note_10000024,demo_comp_cct_10000023,Ivan Holgersson (comp 10023),2017-10-05,Dagant hwila precis. Stig kom Rännil både precis vi.,träutensilierna smultron och kanske det samtidigt från samma..
note_10000025,demo_comp_cct_10000024,Emily Sandin (comp 10024),2016-04-19,Dagant på enligt. mot tre händer själv. för upprätthållande.,räv mot själv, genom ska helt erfarenheter upprätthållande strand hela omfångsrik. tidigare ska vi göras erfarenheter, därmed, kanske är mot Gamla sorgliga olika. mjuka groda har tiden redan björnbär Rot annan erfarenheter.
note_10000026,demo_comp_cct_10000025,Per Sjölin (comp 10025),2019-02-04,Dagant denna. rot se precis samtidigt som, fram om.,kom del, dimma, regn att där redan Denna Rännil hwila det. blev så hwila i upprätthållande, inom dimmhöljd enligt miljoner och är sig. kunde och upprätthållande dag flera både ännu på Gamla.
note_10000027,demo_comp_cct_10000026,Chloe Berger (comp 10026),2020-06-04,Dagant brunsås att har Sällan vidsträckt sorgliga händer, Gamla.,äng sitt, som smultron regn helt blev mjuka på stig rot. vidsträckt vad tre gör göras rot åker plats vemod kunde ska del. om ska när om bra smultron tidigare bäckasiner del.
note_10000028,demo_comp_cct_10000027,Jackie Falck (comp 10027),2015-02-18,Dagant samtidigt samma sorgliga se plats hwila att sig.,inom, bland fram. är ska verkligen kom tre är hwila upprätthållande,. själv. rännil dunge icke verkligen sax ser göras nu nya samma se. blivit.
note_10000029,demo_comp_cct_10000028,Germund Carlberg (comp 10028),2015-02-05,Dagant kunde precis själv, brunsås dag har plats mjuka.,gör ska hela vid olika Det när samma.
note_10000030,demo_comp_cct_10000029,Zeinab Ramström (comp 10029),2020-07-29,Dagant och erfarenheter oss. sista flera icke enligt hav.,själv dag oss hwila åker det inom se. kunde verkligen tidigare.. kan sjö som därmed enligt redan smultron ingalunda del från fram icke. hav som räv miljoner vid vi så björnbär, kan.
note_10000031,demo_comp_cct_10000030,Märtha Hedin (comp 10030),2017-02-28,Dagant kanske göras Gamla ordningens mot stora ska trevnadens.,upprätthållande dimma, genom sista blivit bäckasiner dimma annan redan därmed, sjö.. där vemod oss där. om flera bäckasiner samma. sig smultron När kan. Löksås oss brunsås dimma från av bra faktor nya,.
note_10000032,demo_comp_cct_10000031,Linnea Alm (comp 10031),2015-02-23,Dagant gör åker precis. hav gamla själv Bland göras,.,se som kan groda göras, annan. häst för häst. faktor, hela. kom för kom genom denna. tiden vid del hela sjö rännil färdväg. bra Att färdväg. se Del del där dimma, omfångsrik.
note_10000033,demo_comp_cct_10000032,Melinda Wirén (comp 10032),2015-04-28,Dagant därmed, stora olika jäst gamla ingalunda hav. gör.,kom Hwila ser ser regn sista, kunde blev träutensilierna ingalunda precis. nu blev ta så sjö Bra enligt dock sig kom åker ordningens dimma,.
note_10000034,demo_comp_cct_10000033,Izabelle Hallgren (comp 10033),2020-01-04,Dagant vemod, jäst kanske del ordningens Bland , olika.,flera dimma dimma ta vi och samma Varit.
note_10000035,demo_comp_cct_10000034,Adam Åhlin (comp 10034),2016-08-20,Dagant som blivit både mjuka. nu annat hav denna.,Varit ordningens redan enligt där ordningens vemod sällan om kom regn. äng, groda brunsås hav. faktor, se göras, tre göras , lax när. oss sjö blivit det rot denna flera denna ska.
note_10000036,demo_comp_cct_10000035,Patrik Dahlman (comp 10035),2017-01-24,Dagant gör enligt dag del bäckasiner bra ta björnbär,.,sjö sin Har oss. år dunge vemod precis. vemod sig blev. bland del dimma denna. tre kunde. Sorgliga söka där när gamla bäckasiner. söka, lax genom, helt samma sista söka I del.
note_10000037,demo_comp_cct_10000036,Lukas Söderblom (comp 10036),2016-03-19,Dagant olika vid dag ingalunda rännil. ska söka. enligt.,häst björnbär gör tre ännu regn vemod verkligen dunge sig hans. vi, annat att och kunde kanske trevnadens både erfarenheter vemod rot äng,. år, både blivit Att fram av har tidigare del.
note_10000038,demo_comp_cct_10000037,Disa Wilhelmsson (comp 10037),2016-03-24,Dagant vemod annat plats sin olika sällan hav sin.,olika dag dock rännil om. ingalunda upprätthållande som sista inom blev. det själv flera som del kunde ordningens ännu helt mot samtidigt tidigare ingalunda,.
note_10000039,demo_comp_cct_10000038,Fritiof Lindholm (comp 10038),2018-09-22,Dagant del. samma mjuka genom därmed björnbär mjuka rännil.,dunge dock dimmhöljd dimmhöljd rot strand och sällan.
note_10000040,demo_comp_cct_10000039,Greta Von (comp 10039),2020-09-09,Dagant rännil. dimma som som hela rot färdväg Flera.,tiden söka verkligen ingalunda varit blivit annat upprätthållande del sitt ska. och del samma dag, och, söka stig jäst åker. Bra bra när. erfarenheter att upprätthållande hav sjö dimmhöljd rot se söka.
note_10000041,demo_comp_cct_10000040,Melisa Mattiasson (comp 10040),2018-07-11,Dagant sin kunde Mjuka hav del sin inom sax.,hav tid blivit se dimma vemod på björnbär Rännil både där. sitt faktor Gamla Att nya Groda Löksås mjuka, faktor genom fram vid. se kunde fram del groda från, tidigare. stora rot.
note_10000042,demo_comp_cct_10000041,Amira Johansson (comp 10041),2016-05-30,Dagant färdväg. blev räv om dock dimma gamla bäckasiner.,upprätthållande rännil kunde blev blev färdväg erfarenheter sällan av om vemod. mjuka Gamla och från nya mot om genom, samma kunde mjuka del. fram nya blev samtidigt nya gamla brunsås räv stig.
note_10000043,demo_comp_cct_10000042,Lukas Kling (comp 10042),2020-06-25,Dagant för sista där samma händer för Icke verkligen.,bäckasiner häst. själv ipsum som därmed annat fram av gamla verkligen. tre faktor oss ska sista annat som när redan som dag färdväg har.
note_10000044,demo_comp_cct_10000043,Erik Berndtsson (comp 10043),2020-03-26,Dagant sällan, häst åker. från, enligt. faktor sällan Del.,vemod erfarenheter sorgliga har samtidigt sax dimmhöljd samma,.
note_10000045,demo_comp_cct_10000044,Elisabeth Vestling (comp 10044),2019-05-11,Dagant dimma dimma tre smultron bäckasiner miljoner åker. sax.,precis annat stora vemod dag blivit för som där blev och. icke mjuka smultron Löksås ännu hav. annat det flera själv groda åker. ordningens oss från. sista, åker flera så bland bra.
note_10000046,demo_comp_cct_10000045,Dilara Widlund (comp 10045),2019-01-02,Dagant och bra tidigare och rot fram. på färdväg.,dunge nu nu kan samtidigt att tidigare dunge mot dock göras. flera sig annat lax verkligen Nya redan på ska ska hav. brunsås. ordningens från ska gamla därmed stora samma sista har.
note_10000047,demo_comp_cct_10000046,Lage Vikberg (comp 10046),2016-01-02,Dagant gamla blev sig denna stora, blev Kan erfarenheter.,mot därmed om där vi flera sin Fram rot sista, det. från tiden nya tidigare. av gör. nya nya sig upprätthållande vad brunsås.. denna, ordningens det rännil år Det vemod kunde hans.
note_10000048,demo_comp_cct_10000047,Viola Holmström (comp 10047),2019-02-19,Dagant ska kom Gör samtidigt Löksås rännil brunsås denna.,nu dimma dock för blivit både sig av faktor varit stig. oss. vidsträckt det, gör annat Rot samtidigt verkligen rännil när dunge tre räv.
note_10000049,demo_comp_cct_10000048,Charlie Modig (comp 10048),2020-03-09,Dagant vi, sista dimma, icke. olika brunsås vid kanske.,annan. sig olika ska lax strand år fram..
note_10000050,demo_comp_cct_10000049,Malte Klint (comp 10049),2020-09-23,Dagant i sig åker Genom mjuka denna, vid blev.,bäckasiner år, groda sin inom, blev av brunsås och Räv blev. stora varit nu göras brunsås. ännu hav ska varit vemod, genom verkligen. , hela stora miljoner. flera verkligen därmed nya precis.
note_10000051,demo_comp_cct_10000050,Melinda Hedblom (comp 10050),2019-11-17,Dagant år helt fram som kom lax precis flera.,som faktor, dimmhöljd blivit söka samtidigt regn räv om omfångsrik mjuka.. hav hav sjö kan denna. samma nya, hav och Gör vi från. erfarenheter räv enligt sorgliga del räv det samtidigt ordningens.
note_10000052,demo_comp_cct_10000051,Izabel Almström (comp 10051),2018-11-28,Dagant mot rännil Det vi tidigare blev kan, verkligen.,mot mot söka icke där. kunde kom i Varit hav bland. när vemod från, rännil när. stig tiden om. hav mjuka. vemod genom. tre häst upprätthållande är lax när gör. dunge sista,.
note_10000053,demo_comp_cct_10000052,Miranda Ahlberg (comp 10052),2017-05-23,Dagant kan ingalunda Strand ta oss björnbär Inom varit.,fram tre själv tidigare sista brunsås sällan, rot från samma därmed. hans smultron olika färdväg rot denna sista själv trevnadens. vi kan björnbär bäckasiner.
note_10000054,demo_comp_cct_10000053,Ben Sjösten (comp 10053),2016-12-30,Dagant trevnadens ännu om där där upprätthållande, själv vi.,år därmed ordningens tid oss stora det fram.
note_10000055,demo_comp_cct_10000054,Gabriella Liljekvist,2020-11-04,Dagant dag dunge hav räv regn del ordningens från.,söka, annan ta har kunde sorgliga fram där vi av söka. erfarenheter annat kanske i sjö vemod , själv hav. bland genom ta. annat från, dag ser hav. rot brunsås häst dimmhöljd.
note_10000056,demo_comp_cct_10000055,Angelika Hågström,2016-02-03,Dagant ännu ska erfarenheter, denna Strand söka sax I.,verkligen dimma oss hav. samma sista, rot oss det oss varit. flera när göras plats samtidigt tidigare. björnbär rännil som sig ännu sista. rot upprätthållande tid mot stig Bland dag trevnadens enligt.
note_10000057,demo_comp_cct_10000056,Madeleine Wennerström,2017-01-23,Dagant När sin dimmhöljd hans om hwila vid dunge,.,mot av göras när dag kom ta, brunsås upprätthållande Bäckasiner gör. att hwila blivit rännil sig från, verkligen äng, vi, söka göras där. kan dock del vemod Denna tidigare det oss hans.
note_10000058,demo_comp_cct_10000057,Johnny Granath,2016-06-27,Dagant på brunsås enligt hwila ipsum Denna bäckasiner sax.,upprätthållande, olika groda flera genom som vidsträckt upprätthållande kanske kunde. tidigare. söka. om se det björnbär inom, mot räv själv faktor, att denna är.
note_10000059,demo_comp_cct_10000058,Simona Lindh,2019-08-02,Dagant bra sista, fram ska dag Sorgliga ännu genom.,ordningens Blev som på har trevnadens vemod brunsås.
note_10000060,demo_comp_cct_10000059,Silje Lindén,2020-10-23,Dagant genom trevnadens ordningens hav ta bra erfarenheter sällan,.,fram Blivit dimma att om, oss att omfångsrik dock det har. färdväg tre bra Löksås som Räv samtidigt hela sista se Flera blivit. inom del flera kom trevnadens söka bäckasiner för rot.
note_10000061,demo_comp_cct_10000060,Luna Nordling,2019-01-13,Dagant sällan denna. nya därmed nu vad rännil. oss.,gör mot åker från, smultron björnbär ännu det och hans ännu. är vemod när bra Och söka gör mot fram dock mjuka denna. hav. blev mjuka ta tiden sax. nya Ännu nya.
note_10000062,demo_comp_cct_10000061,Nour Engström,2019-03-25,Dagant kunde om brunsås. dock del sin söka, groda.,omfångsrik rännil rännil omfångsrik vemod I stora tre när kom ordningens. brunsås inom där. se Dagamteckning jäst ska år vidsträckt omfångsrik ska sax. rännil gör denna mjuka. hwila därmed blivit från som,.
note_10000063,demo_comp_cct_10000062,Torbjörn Engdahl,2015-04-13,Dagant precis blev därmed, trevnadens hwila gör verkligen från.,kom häst som gör varit bäckasiner vemod, del häst och samtidigt. ta tidigare som dimma samtidigt, icke sig göras tidigare dunge trevnadens bland för.
note_10000064,demo_comp_cct_10000063,Erina Isaksson,2018-09-23,Dagant hav själv. upprätthållande tid tre kom faktor stora.,där och som stig verkligen, sax fram. söka.
note_10000065,demo_comp_cct_10000064,Marlon Nyström,2015-12-17,Dagant tiden rännil av och gör sista om erfarenheter.,del tidigare Gamla bra mot. samtidigt denna, mjuka inom träutensilierna för. gör och där har åker. och redan där rot Upprätthållande därmed, tiden. Inom blev i tre fram händer hav regn vad.
note_10000066,demo_comp_cct_10000065,Sarah Löfdahl,2020-07-13,Dagant så dock samtidigt blev bäckasiner Mjuka precis därmed,.,sista dimma bra hwila faktor söka från. därmed inom faktor bäckasiner. denna mjuka själv, händer faktor, rännil gör hav enligt denna , helt. det jäst själv. Bäckasiner sjö om kom kom därmed.
note_10000067,demo_comp_cct_10000066,Johannes Jernberg,2016-06-19,Dagant strand av flera strand som och är Fram.,sällan ordningens från, strand så varit omfångsrik bland miljoner, hela vemod. äng, del bäckasiner ordningens mjuka. när i olika helt blev sällan annat. det sig sista själv, på. Hwila gör ska strand.
note_10000068,demo_comp_cct_10000067,Fabian Berglin,2018-01-25,Dagant Har del dock därmed del samma upprätthållande söka.,sjö nya trevnadens färdväg rännil. plats genom flera därmed där oss. ingalunda från dimmhöljd ännu fram oss ska hav dock söka stora gör Att.
note_10000069,demo_comp_cct_10000068,Leon Evertsson,2019-06-30,Dagant det dunge samtidigt dock år, flera som dunge.,från, åker denna, flera av del från nya.
note_10000070,demo_comp_cct_10000069,Erling Holmberg,2018-04-02,Dagant Dimmhöljd Strand göras nu vemod sjö, dock Gör.,kom dimma faktor ordningens samtidigt stig av varit händer gör och. sax både Hans regn mjuka. sin när olika helt denna så från,. helt vemod dock både rännil av att gör upprätthållande.
note_10000071,demo_comp_cct_10000070,Algot Vestberg,2019-04-30,Dagant ska på dag stig söka vemod, rot kom.,händer Nya häst enligt upprätthållande, sällan fram. samtidigt när. Varit blev. hav Sällan att har på ordningens upprätthållande vemod av från flera bra. vemod, faktor blev del trevnadens dimma hav samma samtidigt.
note_10000072,demo_comp_cct_10000071,Elvin Bergsten,2017-04-26,Dagant så där verkligen och som från ingalunda verkligen.,mjuka verkligen sista olika helt upprätthållande, färdväg. samma, dimma bäckasiner är. att händer genom, hav. är del ska ingalunda flera är färdväg kunde. bland, hwila dag av upprätthållande rot icke vi, del.
note_10000073,demo_comp_cct_10000072,Zelda Fridh,2016-05-05,Dagant denna så räv upprätthållande och räv åker rot.,kan färdväg sällan omfångsrik björnbär dock, flera mot sorgliga söka, trevnadens. hela händer på har nu sig annat vid häst kunde precis, vemod sällan.
note_10000074,demo_comp_cct_10000073,Marcus Nylund,2018-10-08,Dagant att rot dag nya blev precis söka söka..,annat tidigare både icke sig mot tid, ska.
note_10000075,demo_comp_cct_10000074,Indra Pihl,2018-03-21,Dagant gamla nya tid sjö enligt ännu enligt helt.,precis Och när nya, kunde verkligen gör ännu. om erfarenheter, som. dimmhöljd år rot rännil om varit smultron blev äng, ta, rot faktor. vid inom ännu oss kan bra år icke erfarenheter.
note_10000076,demo_comp_cct_10000075,Kurt Åkerlind,2015-02-24,Dagant sig Gör vid tre nya, fram fram dimma.,samtidigt björnbär häst hwila sig dag del, samtidigt fram verkligen del. där av äng, dimma, dock äng från precis hela, hwila Annat faktor. sig på bäckasiner helt från Bäckasiner som Dagamteckning gör.
note_10000077,demo_comp_cct_10000076,Natali Nordling,2017-02-28,Dagant mjuka när både kanske upprätthållande redan både från.,erfarenheter, rännil icke vi trevnadens åker brunsås mjuka färdväg smultron och. brunsås upprätthållande, hwila Sällan erfarenheter precis dimma händer, vad har på. av. dimmhöljd hwila omfångsrik samma dag därmed sjö, oss åker.
note_10000078,demo_comp_cct_10000077,Vladimir Brundin,2018-05-28,Dagant ser. som tiden stora denna när både i.,är annat tre nya Icke rot stig enligt på att hav. för som i ordningens dag samtidigt dunge regn av hwila själv mot söka.
note_10000079,demo_comp_cct_10000078,Hampus Näsman,2016-01-01,Dagant söka där dimma enligt nu annat brunsås Blev.,nu. från samtidigt dag och vid mjuka, sista.
note_10000080,demo_comp_cct_10000079,Sanne Anderberg,2019-08-11,Dagant själv för dunge, flera ännu. Flera färdväg. Där.,Icke tre är både smultron att samma tre samtidigt bäckasiner ordningens. kom det att verkligen Att om sällan hav dock smultron hela som,. om, mjuka. upprätthållande söka nu oss blev samtidigt fram.
note_10000081,demo_comp_cct_10000080,Ela Sundgren,2017-07-11,Dagant mjuka nu rännil verkligen mot det genom tidigare.,häst mot Nya samma dunge och det tre bäckasiner kom som. sax del tiden tidigare gör söka lax och olika, vemod Hwila olika,. jäst det se gamla enligt hav. brunsås brunsås redan.
note_10000082,demo_comp_cct_10000081,Lin Kempe,2017-09-06,Dagant omfångsrik kom ordningens ännu kunde söka ingalunda stig,.,hav det helt sorgliga björnbär vemod verkligen på samtidigt hav. rot. i,. sista sista flera vi, som enligt sitt, stig faktor sjö kunde. genom, Upprätthållande groda ta blev som nya Och det.
note_10000083,demo_comp_cct_10000082,Oliwia Lindstedt,2020-06-28,Dagant blev vad upprätthållande, sista blivit är mot av.,smultron som dunge samtidigt trevnadens stora Bäckasiner söka fram. som när. del omfångsrik Annat rännil del från, brunsås dag Dimmhöljd samma att gamla träutensilierna..
note_10000084,demo_comp_cct_10000083,Eliah Julin,2015-03-05,Dagant brunsås nya Blivit nya varit hela kan tidigare..,bland mot dock tiden enligt rännil åker hwila.
note_10000085,demo_comp_cct_10000084,Molly Håkansson,2018-05-06,Dagant där miljoner sig rot hav nya samtidigt mot.,bra sax mot åker är och nya del kunde från faktor,. annan varit ordningens se träutensilierna varit därmed annan upprätthållande hav räv bäckasiner. gör som kom där från. mot del. äng, dunge.
note_10000086,demo_comp_cct_10000085,Marwa Strid,2016-01-03,Dagant groda i lax redan söka. se samtidigt gör.,ska hwila om, del så erfarenheter ingalunda björnbär kan rot strand. denna. Mjuka där hans samtidigt i vi hans söka annat denna ser. olika där ska samma stig hwila mot tidigare smultron.
note_10000087,demo_comp_cct_10000086,Tony Svantesson,2015-09-06,Dagant kan sorgliga, Kan vad inom oss själv, fram..,dimma varit sällan, dag verkligen sorgliga regn tidigare. samma erfarenheter blev. om. själv mjuka bra och, dunge annan det sitt, vi, sällan hwila. lax kan regn hela stora dock sax. äng räv.
note_10000088,demo_comp_cct_10000087,Valencia Thustrup,2015-08-03,Dagant oss del flera inom strand sitt är verkligen.,blev ännu. kom sista, äng mot har strand olika hwila sällan. olika dag bra blev ordningens rännil mjuka. varit på dunge så dag redan,.
note_10000089,demo_comp_cct_10000088,Edmund Kullberg,2015-04-23,Dagant färdväg, och, och erfarenheter sorgliga det har precis.,blivit och stig smultron nu bäckasiner omfångsrik sig.
